{"batches":[{"batchDigest":"sha256:cd94f47aadb63d10b214101a971c3dced0564c9008ce4e0518b52ce1a0819ddd","events":[{"attributes":{"eventKind":"harness.run-created","referenceCount":1,"runRevision":1,"typedKeyKinds":[]},"eventId":"sha256:f899dc32be586618a6a606322d1c681af9d193e6ecd13102e9909c38dd309094","integrity":{"algorithm":"sha256","canonicalization":"ordivon-evidence-json-v1","payloadDigest":"sha256:5976204518881a2296585da8d61b3fb9b2adda8f1683d6a50a16fcb7553d8293"},"kind":"ordivon.observation-envelope","measurements":{},"occurredAtMs":1786086849275,"payloadRef":{"digest":"sha256:3b7775a7432d02882320922621c6b989ab436e20a2fa965f8b7e9a14d30ea96f","kind":"ordivon.harness.event-payload","locatorClass":"owner_cas","nativeId":"event:harness-run-created:fc98a0c5aa1bea531fea576832612d2adcfb2f8df13b27b4d348c23709debeb1","owner":"ordivon-harness"},"privacy":{"class":"private_content_ref","containsInlineContent":false,"policyId":"harness-observation-metadata-v1"},"relations":[{"relationType":"belongs_to","targetId":"harness-run:a0-o1-1786086849266-5a8cef08ce","targetKind":"ordivon.harness.run"},{"relationType":"linked_to","targetId":"external-request:a0-o1-1786086849266-5a8cef08ce","targetKind":"ordivon.host.external-request"},{"relationType":"references","targetDigest":"sha256:1d1b04e0aa20cce7608954b22a1f39fc41314147ee994c66b9f84b05aad06911","targetId":"sha256:1d1b04e0aa20cce7608954b22a1f39fc41314147ee994c66b9f84b05aad06911","targetKind":"ordivon.harness.object"},{"relationType":"requested_by","targetId":"caller:ordivon-host","targetKind":"ordivon.harness.caller"}],"schemaVersion":1,"source":{"componentId":"harness-journal","instanceId":"harness:a0-o1-1786086849266-5a8cef08ce","mappingVersion":"harness-observation-v1","nativeDigest":"sha256:74c8016f87d5249d2e7e4eec5a14114df0ea07131a6d1a66aeccdc380dabc008","nativeId":"event:harness-run-created:fc98a0c5aa1bea531fea576832612d2adcfb2f8df13b27b4d348c23709debeb1","nativeKind":"ordivon.harness.harness.run-created","nativeRevision":1,"projectId":"ordivon-harness","sequence":1,"streamId":"harness-journal:harness:a0-o1-1786086849266-5a8cef08ce"}},{"attributes":{"eventKind":"harness.provider-call-claimed","referenceCount":2,"runRevision":2,"typedKeyKinds":[]},"eventId":"sha256:c4f02e7358c4f92ae076a191bde429a40b3a614db6552339ac5b023316b694c6","integrity":{"algorithm":"sha256","canonicalization":"ordivon-evidence-json-v1","payloadDigest":"sha256:255a22cde0e361a8888071aee7fb53def6b68e7264c24dbd6b82d6eb7425066b"},"kind":"ordivon.observation-envelope","measurements":{},"occurredAtMs":1786086849590,"payloadRef":{"digest":"sha256:43d4f81ca8fcfcd71bbb9f2dfff4b0d6e6e497346c99cc154f566c2a59d009c4","kind":"ordivon.harness.event-payload","locatorClass":"owner_cas","nativeId":"event:harness-continuity:provider:47a50a80f465b698aab8baca","owner":"ordivon-harness"},"privacy":{"class":"private_content_ref","containsInlineContent":false,"policyId":"harness-observation-metadata-v1"},"relations":[{"relationType":"belongs_to","targetId":"harness-run:a0-o1-1786086849266-5a8cef08ce","targetKind":"ordivon.harness.run"},{"relationType":"linked_to","targetId":"external-request:a0-o1-1786086849266-5a8cef08ce","targetKind":"ordivon.host.external-request"},{"relationType":"references","targetDigest":"sha256:49cc9479c7a843cf9f39a9cd875ef58b17d77fdaac2d89c6267d8637989f70b7","targetId":"sha256:49cc9479c7a843cf9f39a9cd875ef58b17d77fdaac2d89c6267d8637989f70b7","targetKind":"ordivon.harness.object"},{"relationType":"references","targetDigest":"sha256:8c9aa450d04f34a81d0812b9c72e2595e1eb1807f5e16d3cef1235a1d51ea6ab","targetId":"sha256:8c9aa450d04f34a81d0812b9c72e2595e1eb1807f5e16d3cef1235a1d51ea6ab","targetKind":"ordivon.harness.object"},{"relationType":"requested_by","targetId":"caller:ordivon-host","targetKind":"ordivon.harness.caller"}],"schemaVersion":1,"source":{"componentId":"harness-journal","instanceId":"harness:a0-o1-1786086849266-5a8cef08ce","mappingVersion":"harness-observation-v1","nativeDigest":"sha256:d56a495467bdce47b2cbd6e9d54fc1d64aff0efbbcf04bfd973fc94a07a77086","nativeId":"event:harness-continuity:provider:47a50a80f465b698aab8baca","nativeKind":"ordivon.harness.harness.provider-call-claimed","nativeRevision":2,"projectId":"ordivon-harness","sequence":2,"streamId":"harness-journal:harness:a0-o1-1786086849266-5a8cef08ce"}},{"attributes":{"eventKind":"harness.provider-call-dispatching","referenceCount":2,"runRevision":3,"typedKeyKinds":[]},"eventId":"sha256:21ca72f473e4a971e0a3e1c82de82cfbbbb7d29dcf4687580d68397bf6988124","integrity":{"algorithm":"sha256","canonicalization":"ordivon-evidence-json-v1","payloadDigest":"sha256:a471e77a41c795b7c1e482182c8c303b384cd4f5bd01ee9e64653ffc80ebd89d"},"kind":"ordivon.observation-envelope","measurements":{},"occurredAtMs":1786086849629,"payloadRef":{"digest":"sha256:ce95b33db8ffd4e18347a580366c173fe595f8aa1be2d750dc2d025337c746ca","kind":"ordivon.harness.event-payload","locatorClass":"owner_cas","nativeId":"event:harness-continuity:provider:2fecc93396911c1454a3fbc3","owner":"ordivon-harness"},"privacy":{"class":"private_content_ref","containsInlineContent":false,"policyId":"harness-observation-metadata-v1"},"relations":[{"relationType":"belongs_to","targetId":"harness-run:a0-o1-1786086849266-5a8cef08ce","targetKind":"ordivon.harness.run"},{"relationType":"caused_by","targetId":"event:harness-continuity:provider:47a50a80f465b698aab8baca","targetKind":"ordivon.harness.event"},{"relationType":"linked_to","targetId":"external-request:a0-o1-1786086849266-5a8cef08ce","targetKind":"ordivon.host.external-request"},{"relationType":"references","targetDigest":"sha256:b78f478a016ed317cc9bbbf641056434ba84a4cea5f77531eef0d43b572f8b75","targetId":"sha256:b78f478a016ed317cc9bbbf641056434ba84a4cea5f77531eef0d43b572f8b75","targetKind":"ordivon.harness.object"},{"relationType":"references","targetDigest":"sha256:d47ea9d41a21d541951450b2c3abcdffd048a8254395eb5c50ac4bdabccaf4f1","targetId":"sha256:d47ea9d41a21d541951450b2c3abcdffd048a8254395eb5c50ac4bdabccaf4f1","targetKind":"ordivon.harness.object"},{"relationType":"requested_by","targetId":"caller:ordivon-host","targetKind":"ordivon.harness.caller"}],"schemaVersion":1,"source":{"componentId":"harness-journal","instanceId":"harness:a0-o1-1786086849266-5a8cef08ce","mappingVersion":"harness-observation-v1","nativeDigest":"sha256:5f2064d3fe0099e7382674c0c97beb17e3c79065b4008b2af7ec7834d1211171","nativeId":"event:harness-continuity:provider:2fecc93396911c1454a3fbc3","nativeKind":"ordivon.harness.harness.provider-call-dispatching","nativeRevision":3,"projectId":"ordivon-harness","sequence":3,"streamId":"harness-journal:harness:a0-o1-1786086849266-5a8cef08ce"}},{"attributes":{"eventKind":"harness.provider-call-completed","referenceCount":3,"runRevision":4,"typedKeyKinds":[]},"eventId":"sha256:295f86fa3cd583b7ef97959f0f46cf6401f47074f099e86fa57ad6d5bfc32814","integrity":{"algorithm":"sha256","canonicalization":"ordivon-evidence-json-v1","payloadDigest":"sha256:aa11fbde6b782d0089356c16204f896e14c96adfb7350f8cfa0b7cbb1622f5fe"},"kind":"ordivon.observation-envelope","measurements":{},"occurredAtMs":1786086849670,"payloadRef":{"digest":"sha256:5f4f32c646da4317a3e604657ed19b3997938b5383722bc1156f2780d307a053","kind":"ordivon.harness.event-payload","locatorClass":"owner_cas","nativeId":"event:harness-continuity:provider:bdcc8af12069528920a915fa","owner":"ordivon-harness"},"privacy":{"class":"private_content_ref","containsInlineContent":false,"policyId":"harness-observation-metadata-v1"},"relations":[{"relationType":"belongs_to","targetId":"harness-run:a0-o1-1786086849266-5a8cef08ce","targetKind":"ordivon.harness.run"},{"relationType":"caused_by","targetId":"event:harness-continuity:provider:2fecc93396911c1454a3fbc3","targetKind":"ordivon.harness.event"},{"relationType":"linked_to","targetId":"external-request:a0-o1-1786086849266-5a8cef08ce","targetKind":"ordivon.host.external-request"},{"relationType":"references","targetDigest":"sha256:22bc013f24929b8f680300d28198a33e0591a7267782b5f126514b9fd2c2366d","targetId":"sha256:22bc013f24929b8f680300d28198a33e0591a7267782b5f126514b9fd2c2366d","targetKind":"ordivon.harness.object"},{"relationType":"references","targetDigest":"sha256:da0a7989a9ac5350bb29a02e331a5fa4f9238a202e2e25ceded3feff99270d3d","targetId":"sha256:da0a7989a9ac5350bb29a02e331a5fa4f9238a202e2e25ceded3feff99270d3d","targetKind":"ordivon.harness.object"},{"relationType":"references","targetDigest":"sha256:fd250691935e721b18ea35d65ffbc3fbbc691c124af7e4382f6051d6a55c7916","targetId":"sha256:fd250691935e721b18ea35d65ffbc3fbbc691c124af7e4382f6051d6a55c7916","targetKind":"ordivon.harness.object"},{"relationType":"requested_by","targetId":"caller:ordivon-host","targetKind":"ordivon.harness.caller"}],"schemaVersion":1,"source":{"componentId":"harness-journal","instanceId":"harness:a0-o1-1786086849266-5a8cef08ce","mappingVersion":"harness-observation-v1","nativeDigest":"sha256:0986d05bc45638cffe6950797ec8f49c9e6d83402d27a415ce03a61bccdc1966","nativeId":"event:harness-continuity:provider:bdcc8af12069528920a915fa","nativeKind":"ordivon.harness.harness.provider-call-completed","nativeRevision":4,"projectId":"ordivon-harness","sequence":4,"streamId":"harness-journal:harness:a0-o1-1786086849266-5a8cef08ce"}},{"attributes":{"eventKind":"harness.tool-step-prepared","referenceCount":4,"runRevision":5,"typedKeyKinds":["harness-dispatch-fence"]},"eventId":"sha256:b612d5e28fb95f828175f0740b362989e1b932c5ea701625f05574ecc27e8123","integrity":{"algorithm":"sha256","canonicalization":"ordivon-evidence-json-v1","payloadDigest":"sha256:5a57a1b1728ff27020dfe8439549523d9dda3161ea832d2d2dc345e6838e8049"},"kind":"ordivon.observation-envelope","measurements":{},"occurredAtMs":1786086849732,"payloadRef":{"digest":"sha256:b9e3a6b5b067cb5867a5a7c3900b2df36f32616d4147c6efabce2e90396ad439","kind":"ordivon.harness.event-payload","locatorClass":"owner_cas","nativeId":"event:harness-continuity:tool-prepared:13095f396035d0350c70a217","owner":"ordivon-harness"},"privacy":{"cla